{
  "audit": {
    "gates_terms_sha256": "b3bc4610551b40ffd2f675711d493d12a72781f08c2979bede7d28c878dc48bb",
    "policy_bytes_sha256": "1db985beac5bb77c3a45632c435ec6fbd920645abc542db0be7ca26f5d0e8a27",
    "policy_terms_sha256": "0ebd0b1685d0444d0e36003a3bd3a3b27c652a468b428a11eb94eaf249ca770e",
    "route_force_full": true,
    "route_minimum_level": 3,
    "route_unknowns": [
      "ADC-ROUTE-UNMAPPED-PATH",
      "ADC-ROUTE-UNROUTED-FACT"
    ]
  },
  "base_gate_outcomes": {
    "distribution": "pass",
    "full-suite": "pass",
    "hostile-environment": "unresolved",
    "mutation-replay": "unresolved",
    "validate-core": "pass"
  },
  "base_reconstructed": true,
  "class": {
    "matched_rule_ids": [
      "docs-only",
      "product-code",
      "verification-authority"
    ],
    "omitted_gate_ids": [],
    "router_blob_sha256": "d0d40e77a26430eacc2851f8641b47d618e8d8550a55cb91de50c49fb70950f7",
    "selected_gate_ids": [
      "distribution",
      "full-suite",
      "hostile-environment",
      "mutation-replay",
      "validate-core"
    ],
    "terms_sha256": "e83d5401edacd7afa47dc25c2920396dd2fe57d4025fbfdf04dfb4f3b6c212a6"
  },
  "class_key": "b3d197a8da0aea5e78d059df88d72de74806e97789745e4b67251be86f69dea6",
  "commits": {
    "base": "a34dcb46512b7f63f3f07dbc0c87f8224cb3906d",
    "head": "a5d61d64de637f48e3790d2684f30ac24044f409",
    "merge": "9361ada4098a540a5dfa50a0e578bb886669bb64"
  },
  "gate_outcomes": {
    "distribution": "pass",
    "full-suite": "fail",
    "hostile-environment": "unresolved",
    "mutation-replay": "unresolved",
    "validate-core": "pass"
  },
  "head_ref": "recover/mutation-fuzz-stack",
  "inconclusive_reason": null,
  "measurable": false,
  "not_measurable_reason": "gates without a decided outcome: hostile-environment=unresolved, mutation-replay=unresolved",
  "provenance": "backfill",
  "record_id": "d5e079f3023b86770821e2a51631578c2b3bad7dd2abc2824753c360b877b2eb",
  "run": {
    "pull_request": 16,
    "run_attempt": 1,
    "run_id": "32597122161"
  },
  "schema": "shadow-record-v2",
  "schema_version": 2,
  "shadow": null,
  "status": "not_measurable"
}
