{
  "audit": {
    "gates_terms_sha256": "b3bc4610551b40ffd2f675711d493d12a72781f08c2979bede7d28c878dc48bb",
    "policy_bytes_sha256": "1db985beac5bb77c3a45632c435ec6fbd920645abc542db0be7ca26f5d0e8a27",
    "policy_terms_sha256": "0ebd0b1685d0444d0e36003a3bd3a3b27c652a468b428a11eb94eaf249ca770e",
    "route_force_full": true,
    "route_minimum_level": 3,
    "route_unknowns": [
      "ADC-ROUTE-UNMAPPED-PATH",
      "ADC-ROUTE-UNROUTED-FACT"
    ]
  },
  "base_gate_outcomes": {
    "distribution": "pass",
    "full-suite": "pass",
    "hostile-environment": "unresolved",
    "mutation-replay": "unresolved",
    "validate-core": "pass"
  },
  "base_reconstructed": true,
  "class": {
    "matched_rule_ids": [
      "product-code",
      "verification-authority"
    ],
    "omitted_gate_ids": [],
    "router_blob_sha256": "d0d40e77a26430eacc2851f8641b47d618e8d8550a55cb91de50c49fb70950f7",
    "selected_gate_ids": [
      "distribution",
      "full-suite",
      "hostile-environment",
      "mutation-replay",
      "validate-core"
    ],
    "terms_sha256": "ec45501c408d6a823e08cb61e6eb9650250e18c41a2b060e001e6c638ca68ef5"
  },
  "class_key": "9041c3f5bd63c021bc9407a9dca50bcb90c34966b409da85f64f159956a345a7",
  "commits": {
    "base": "99a3eb08fc93d8fcaee88cb4932be27518517319",
    "head": "1cedc45eec355908fc9038d6ac60fff83678cf35",
    "merge": "10be7b1299ea3c468efde2e66c5ff770f84423cf"
  },
  "gate_outcomes": {
    "distribution": "pass",
    "full-suite": "pass",
    "hostile-environment": "pass",
    "mutation-replay": "unresolved",
    "validate-core": "pass"
  },
  "head_ref": "fix/locale-safe-git-output",
  "inconclusive_reason": null,
  "measurable": false,
  "not_measurable_reason": "gates without a decided outcome: mutation-replay=unresolved",
  "provenance": "backfill",
  "record_id": "ea3a3618b64e9bcfd8a161352e36cefe12c686555560137c25b2caa5e78eba5c",
  "run": {
    "pull_request": 18,
    "run_attempt": 1,
    "run_id": "32601995999"
  },
  "schema": "shadow-record-v2",
  "schema_version": 2,
  "shadow": null,
  "status": "not_measurable"
}
