{
  "audit": {
    "gates_terms_sha256": "b3bc4610551b40ffd2f675711d493d12a72781f08c2979bede7d28c878dc48bb",
    "policy_bytes_sha256": "1db985beac5bb77c3a45632c435ec6fbd920645abc542db0be7ca26f5d0e8a27",
    "policy_terms_sha256": "0ebd0b1685d0444d0e36003a3bd3a3b27c652a468b428a11eb94eaf249ca770e",
    "route_force_full": true,
    "route_minimum_level": 3,
    "route_unknowns": [
      "ADC-ROUTE-UNROUTED-FACT"
    ]
  },
  "base_gate_outcomes": null,
  "base_reconstructed": true,
  "class": {
    "matched_rule_ids": [
      "docs-only",
      "schema-contract",
      "verification-authority"
    ],
    "omitted_gate_ids": [],
    "router_blob_sha256": "d0d40e77a26430eacc2851f8641b47d618e8d8550a55cb91de50c49fb70950f7",
    "selected_gate_ids": [
      "distribution",
      "full-suite",
      "hostile-environment",
      "mutation-replay",
      "validate-core"
    ],
    "terms_sha256": "cc0f4c8eb2607383672a36cfbb72ae2c410b48d57aa399f031d0659b96ebff9f"
  },
  "class_key": "fac413c95af473686448b4dce55a6985207cb0652d6ea477472ee5fbdf87e578",
  "commits": {
    "base": "cbdc03ee22453d532c2477938e253adb5b2b4c5f",
    "head": "0ace58f2cc95f29ed96a17c407de95690806e89d",
    "merge": "cd6704a2f265ed6819c4989adf1bfe5a59a7450a"
  },
  "gate_outcomes": {
    "distribution": "pass",
    "full-suite": "pass",
    "hostile-environment": "pass",
    "mutation-replay": "pass",
    "validate-core": "pass"
  },
  "head_ref": "claude/round-twenty-verify",
  "inconclusive_reason": null,
  "measurable": true,
  "not_measurable_reason": null,
  "provenance": "backfill",
  "record_id": "4a46fadbd2c956d9fbf6f3497c38d248d3a66b66927d0bc7377c07d5d89437b6",
  "run": {
    "pull_request": 30,
    "run_attempt": 1,
    "run_id": "33671714111"
  },
  "schema": "shadow-record-v2",
  "schema_version": 2,
  "shadow": null,
  "status": "no_omission"
}
